{
  "$schema": "http://json-schema.org/draft-07/schema#",
  "$id": "https://raw.githubusercontent.com/stroupaloop/openclaw-resolver/main/schemas/catalog.v1.json",
  "title": "OpenClaw Resolver Description Catalog",
  "description": "Tool + skill descriptions consumed by the classifier's system prompt. Used for both the shipped defaults (default-catalog.json) and the operator-writable override file (catalogOverridesFile).",
  "type": "object",
  "required": ["schemaVersion"],
  "properties": {
    "$schema": { "type": "string" },
    "schemaVersion": { "type": "integer", "const": 1 },
    "description": { "type": "string" },
    "tools": {
      "type": "object",
      "description": "Map of tool ID to description string. Keys match runtime-exposed tool IDs (e.g. 'nodes', 'web_search').",
      "additionalProperties": { "type": "string" }
    },
    "skills": {
      "type": "object",
      "description": "Map of skill ID to description string. Keys match runtime-exposed skill IDs.",
      "additionalProperties": { "type": "string" }
    },
    "_meta": {
      "type": "object",
      "description": "Optional metadata for operators (not read by the plugin).",
      "properties": {
        "lastModifiedBy": { "type": "string" },
        "lastModifiedAt": { "type": "string", "format": "date-time" },
        "source": { "type": "string" }
      },
      "additionalProperties": true
    }
  },
  "additionalProperties": false
}
